link;title;address;price;acreage;published;hashtag;description
https://phongtro123.com/khai-truong-ktx-trung-tam-do-thi-quan-10-co-hoi-don-uu-dai-hap-dan-pr662818.html; KHAI TRƯƠNG KTX TRUNG TÂM ĐÔ THỊ QUẬN 10 - CƠ HỘI ĐÓN ƯU ĐÃI HẤP DẪN!; Địa chỉ: Đường Thành Thái, Phường 14, Quận 10, Hồ Chí Minh; 1.3 triệu/tháng;  175m; 16 giờ trước; 662818; KHAI TRƯƠNG KTX TRUNG TÂM ĐÔ THỊ QUẬN 10 - CƠ HỘI ĐÓN ƯU ĐÃI HẤP DẪN!   Đăng Kí Nhanh Trong Tháng 8 - Nhận Ngay Phần Quà Ưu Đãi Lên Đến 300k  Giá Trọn Gói: Chỉ 1.300.000đ - Bao Gồm Toàn Bộ Chi Phí: Điện, Nước, Wifi, Máy Giặt, Máy Lạnh, Thang Máy, Vệ Sinh - Không Cần Lo Lắng Về Chi Phí Phát Sinh.  Gần Các Trường Đại Học: Dễ Dàng Di Chuyển Tới 3 phút đến Huflit Sư Vạn Hạnh, 3 phút UEH CSB&C, 4 phút CĐ Sư phạm Trung ương, 6 phút CNTT Gia Định, 5 phút Học viện Hành Chính, 3 phút Bách Khoa, 1 phút Y Phạm Ngọc Thạch, ĐH Y Dược …  Tiện Nghi Xung Quanh: Gần Chợ, Bến Xe Buýt, Cửa Hàng Bách Hoá Xanh, Vinmart, Siêu Thị, …  Liên Hệ Xem Phòng: 0911529679 (Zalo/Call)  Các cở sở trực thuộc khác: CS 52 Nguyễn Giản Thanh, Phường 15, Quận 10 CS 163/8 Thành Thái, Phường 14, Quận 10 CS 17/1A Hồ Văn Huê, Phường 9, Quận Phú Nhuận  CS 60 Nguyễn Tri Phương P6 Q5 CS 148/2 Bàu Cát 1 Tân Bình CS 69 Nguyễn Gia Trí P25 Bình Thạnh CS 55 Nguyễn Kiệm Gò Vấp  Nhiều chi nhánh khác ở , , , , ̀ ̣, ̂ ̀, ̀ ̂́, ̉ Đ̛́....
https://phongtro123.com/can-tro-rieng-biet-q3-40-ny-co-ban-m2-gio-tu-do-khong-chung-chu-pr662822.html; Căn trọ riêng biệt Q3 40 NY cơ bản m2 giờ tự do không chung chủ; Địa chỉ: 237/96 Trần Văn Đang, Phường 11, Quận 3, Hồ Chí Minh; 4.5 triệu/tháng;  40m; 8 giờ trước; 662822; Nguyên căn 4 x 18 gồm 03 Phòng lớn tách bếp và WC sạch sẽ 1 trệt 1 lầu Trệt gồm 1 phòng lớn 40 m2 có bếp ,WC,máy lạnh,quạt Trần,tủ lạnh,giếng trời và nhà để xe giá 6 triệu giảm 500k cho 3 tháng đầu Lầu 1 gồm 2 phòng Phòng lớn 40m2 có bếp,WC,máy lạnh,quạt Trần,tủ lạnh,2 cửa sổ,1 ban công giếng trời thoáng mát,giá 6 triệu giảm 500k cho 3 tháng đầu Phòng nhỏ 30m2 mặt tiền có bếp,WC,máy lạnh,tủ lạnh giá 4,5 triệu Có máy giặt dùng chung Hẻm rộng thông thoáng cách Hoàng sa 50 mét,DC 237/96 Trần văn đang p11 q3 Giá 1 phòng từ 4,5 - 6 triệu Điện 3,5k nước 100k free xe rác 50k Liên hệ 0902728761
https://phongtro123.com/ktx-sinh-vien-bach-dang-binh-thanh-gan-nga-tu-hang-xanh-dh-hutech-k-phat-sinh-chi-phi-pr662829.html; KTX Sinh Viên, Bạch Đằng, Bình Thạnh, Gần Ngã Tư Hàng Xanh, ĐH HuTech, K Phát Sinh Chi Phí; Địa chỉ: Bạch Đằng, Phường 15, Quận Bình Thạnh, Hồ Chí Minh; 1.8 triệu/tháng;  60m; 7 giờ trước; 662829;  KÍ TÚC XÁ SINH VIÊN TẠI BÌNH THẠNH  Địa chỉ: Bạch Đằng, phường 15, quận bình thạnh  Giá thuê: 1.800.000 VNĐ/tháng + Bao hết  Tiện nghi: • Bao điện nước • Có máy Giặt + Máy lạnh + Tủ lạnh • Free Wifi • Có sân thượng rộng • Cửa sổ thoáng mát cả ngày • Có bếp nấu ăn
https://phongtro123.com/chinh-chu-cho-thue-can-ho-1-ngu-1-khach-pho-trung-hoa-cau-giay-50m2-gia-tu-7tr-pr662823.html; CHÍNH CHỦ CHO THUÊ CĂN HỘ 1 NGỦ 1 KHÁCH PHỐ TRUNG HÒA, CẦU GIẤY 50m2 GIÁ TỪ 7TR; Địa chỉ: 59b Đường Trần Duy Hưng, Phường Trung Hòa, Quận Cầu Giấy, Hà Nội; 7 triệu/tháng;  50m; 8 giờ trước; 662823; CĂN HỘ 1 NGỦ 1 KHÁCH TẠI ĐƯỜNG TRẦN DUY HƯNG, CẦU GIẤY CHỈ TỪ 7TR - CHÍNH CHỦ CHO THUÊ  - Diện tích: 50m2 - Nhà có 1 phòng ngủ, 1 phòng khách, tòa nhà có 8 tầng, có thang máy, bảo vệ 24/7, an ninh đảm bảo - Đảm bảo PCCC, có ban công, lối thoát hiểm, cửa chống cháy thang dây, hệ thống chữa cháy tự động. - Nội thất full đồ: Điều hòa, nóng lạnh, tủ lạnh, hệ thống tủ bếp, bếp từ đôi, sofa, bàn làm việc ... - Có nhận khách nước ngoài và nuôi pet nhỏ. Bãi đỗ ô tô Viện Khoa Học Công Nghệ đối diện ngõ. - Điện 3,9k. Nước 30k, gửi xe 100K. CAM KẾT THÔNG TIN CHUẨN 100%, MIỄN TRUNG GIAN Liên hệ: 0962510123
https://phongtro123.com/cho-thue-can-ho-mini-35m2-tai-26-duong-so-30-p6-go-vap-pr662828.html; Cho thuê căn hộ mini 32m2 tại 26 đường số 30 - P6 - Gò Vấp; Địa chỉ: 26 Đường số 30, Phường 6, Quận Gò Vấp, Hồ Chí Minh; 3.2 triệu/tháng;  32m; 7 giờ trước; 662828; Chính chủ cho thuê phòng tại 26 đường số 30 - P6 - GV. DT: 32m2, phòng có gác rộng, chỗ nấu ăn riêng biệt, máy lạnh invecter ra vào cửa khóa vân tay, camera an ninh gần chợ, gần ngã tư Lê Đức Thọ - Nguyễn Oanh thuận tiện đi lại, giờ giấc tự do giá 3.2 triệu/tháng LH: 0937923579 Chị Mãi
https://phongtro123.com/cho-thue-phong-tro-gac-lung-cao-2m-cua-so-lon-gia-sinh-vien-tai-quan-7-pr662821.html; Cho Thuê Phòng Trọ Gác Lửng Cao 2m Cửa Sổ Lớn Giá Sinh Viên Tại Quận 7; Địa chỉ: A9 Cao Thị Chính, Phường Phú Thuận, Quận 7, Hồ Chí Minh; 4.5 triệu/tháng;  25m; 8 giờ trước; 662821; Phòng Trọ Rộng Rãi Sạch Sẽ Giá Hợp Lý - Giá Hạt Dẻ Bao Khu Vực Quận 7  Địa chỉ: 803 huỳnh tấn phát,phú thuân,quận 7 Diện tích rộng rãi phù hợp ở 3-4 người  Tiện ích tòa nhà: Thang bộ Giờ giấc tự do - không chung chủ Camera an ninh - khu dân cư yên tĩnh Máy giặt chung - Hầm giữ xe rộng rãi  Tiện ích xung quanh: Gần chợ phú thuận,siêu thị,trung tâm thương mại Big C,cầu phú mỹ,kcx tân thuận,ufm,tdt,đại học mở hcm,phú mỹ hưng,..  Liên hệ : 0936209422 - Thành để biết thêm chi tiết
https://phongtro123.com/cho-thue-phong-1-500-000-o-ghep-2-pr662833.html; Cho thuê phòng 1,500,000 (Ở GHÉP); Địa chỉ: Đường Huỳnh Khương An, Phường 5, Quận Gò Vấp, Hồ Chí Minh; 1.5 triệu/tháng;  50m; 6 giờ trước; 662833; Cách trường ĐH Công Nghiệp TPHCM 3 phút đi bộ, ngay sau cổng 4 Ngay chợ Gò Vấp tiện việc nấu ăn, có chổ để xe máy Phòng 50m2, thoáng mát, rộng rãi, nhà mới xây, có ban công dài 5m, toilet trong phòng rộng rãi vòi sen nước nóng lạnh đầy đủ, Khu vực an ninh tốt. Ưu tiên sinh viên năm nhất, chỉ cho sv Nữ thuê. Các bạn đã đi làm và sinh viên Nam vui lòng bỏ qua thông tin này.
https://phongtro123.com/can-tim-nu-o-ghep-kham-thien-a-pr662831.html; Cần tìm nữ ở ghép khâm thiên ạ; Địa chỉ: Số 3 Phố Khâm Thiên, Phường Khâm Thiên, Quận Đống Đa, Hà Nội; 3.7 triệu/tháng;  45m; 7 giờ trước; 662831; Mình thuê phòng 2n1k cần tìm thêm nữ ở ghép (hiện tại đã có 3 nữ). Có thể chuyển vào luôn. Đóng 1 cọc 1, được nuôi pet Giá phòng 7tr5 Điện 3.8k/số, nước 35k/khối Dịch vụ 150k/người, wifi 100k/ phòng
https://phongtro123.com/phong-tro-gia-re-an-ninh-tot-ha-tang-tot-phong-khep-kin-20m2-pr662830.html; Phòng trọ giá rẻ an ninh tốt, hạ tầng tốt phòng khép kín 20m2; Địa chỉ: 19 đường An Thành 2, Phường Yên Phụ, Quận Tây Hồ, Hà Nội; 1.9 triệu/tháng;  20m; 7 giờ trước; 662830; Có 01 phòng trọ trống từ ngày 01/09/2024 Phòng trọ khép kín, an ninh tốt, hạ tầng tốt, điện nước ổn định Giá thuê phòng 1900k/ tháng  Ưu tiên đôi vợ chồng trẻ, học sinh sinh viên, người lao động có công việc ổn định nhân thân tốt đặc điểm nhà cấp 4 nối đi thuận tiện có sân sinh hoạt chung ( nhà 1 tầng, gác xép bê tông)
https://phongtro123.com/phong-cho-thue-sinh-vien-ueh-vhu-pr662827.html; Phòng cho thuê Sinh Viên UEH, VHU trong chung cư Aview; Địa chỉ: Đường Nguyễn Văn Linh, Xã Phong Phú, Huyện Bình Chánh, Hồ Chí Minh; 2.5 triệu/tháng;  15m; 8 giờ trước; 662827; Chính chủ cho thuê phòng trong chung cư AVIEW đối diện ĐH UEH, ĐH VHU (đi bộ 5p). Phòng trong chung cư rất an ninh, thoáng mát. Phòng rộng rãi phù hợp ở 1-2-3-4 người. Giá phòng chỉ từ 2,5tr (có máy lạnh, máy giặt, tủ lạnh,...) free wifi, dọn dẹp vệ sinh hàng tuần chi tiết liên hệ zalo chính chủ theo sđt đăng tin
